{
  "$schema": "https://json-schema.org/draft-07/schema",
  "type": "object",
  "required": ["name", "slug", "author", "version", "description", "games", "repository", "download"],
  "properties": {
    "name": { "type": "string", "minLength": 1 },
    "slug": { "type": "string", "pattern": "^[a-z0-9-]+$" },
    "author": { "type": "string", "minLength": 1 },
    "version": { "type": "string", "pattern": "^\\d+\\.\\d+\\.\\d+$" },
    "description": { "type": "string", "maxLength": 300 },
    "games": { "type": "array", "items": { "type": "string" }, "minItems": 1 },
    "dependencies": { "type": "array", "items": { "type": "string" } },
    "repository": { "type": "string", "format": "uri" },
    "download": { "type": "string", "format": "uri" },
    "categories": { "type": "array", "items": { "type": "string" } },
    "nsfw": { "type": "boolean" },
    "deprecated": { "type": "boolean" }
  },
  "additionalProperties": false
}
