{
  "name": "Example Mod",
  "slug": "example-mod",
  "author": "Prismo Studio",
  "version": "1.0.0",
  "description": "An example mod to demonstrate the registry format",
  "games": ["lethal-company"],
  "dependencies": ["BepInEx"],
  "repository": "https://github.com/Prismo-Studio/example-mod",
  "download": "https://github.com/Prismo-Studio/example-mod/releases/download/v1.0.0/ExampleMod.dll",
  "categories": ["Mods"],
  "nsfw": false,
  "deprecated": false
}
