{
  "name": "Injury System",
  "slug": "repo-injury-system",
  "author": "MathisBls",
  "version": "1.0.0",
  "description": "Adds a realistic injury system to R.E.P.O. Body parts get injured on damage, affecting movement, grip, vision, and stamina.",
  "games": ["repo"],
  "dependencies": ["BepInEx"],
  "repository": "https://github.com/MathisBls/R.E.P.O-injury-system",
  "download": "https://github.com/MathisBls/R.E.P.O-injury-system/releases/download/v1.0.0/InjurySystem.dll",
  "categories": ["Mods"],
  "nsfw": false,
  "deprecated": false
}
